<?xml version="1.0" encoding="UTF-8"?>

<!ELEMENT generatorConfiguration (properties?, classPathEntry*, context+)>

<!ELEMENT properties EMPTY>
<!ATTLIST properties
  resource CDATA #IMPLIED
  url CDATA #IMPLIED>

<!ELEMENT context (property*, plugin*, commentGenerator?, (connectionFactory | jdbcConnection), javaTypeResolver?,
        javaControllerGenerator,javaServiceGenerator,javaModelGenerator, sqlMapGenerator?, javaClientGenerator?, table+)>
<!ATTLIST context id ID #REQUIRED
  defaultModelType CDATA #IMPLIED
  targetRuntime CDATA #IMPLIED
  introspectedColumnImpl CDATA #IMPLIED>

<!ELEMENT connectionFactory (property*)>
<!ATTLIST connectionFactory
  type CDATA #IMPLIED>

<!ELEMENT jdbcConnection (property*)>
<!ATTLIST jdbcConnection 
  driverClass CDATA #REQUIRED
  connectionURL CDATA #REQUIRED
  userId CDATA #IMPLIED
  password CDATA #IMPLIED>

<!ELEMENT classPathEntry EMPTY>
<!ATTLIST classPathEntry
  location CDATA #REQUIRED>

<!ELEMENT property EMPTY>
<!ATTLIST property
  name CDATA #REQUIRED
  value CDATA #REQUIRED>

<!ELEMENT plugin (property*)>
<!ATTLIST plugin
  type CDATA #REQUIRED>


<!ELEMENT javaControllerGenerator (property*)>
<!ATTLIST javaControllerGenerator
        targetPackage CDATA #REQUIRED
        targetProject CDATA #REQUIRED
        implementationPackage CDATA #IMPLIED>

<!ELEMENT javaServiceGenerator (property*)>
<!ATTLIST javaServiceGenerator
        targetPackage CDATA #REQUIRED
        targetProject CDATA #REQUIRED
        implementationPackage CDATA #IMPLIED>

<!ELEMENT javaModelGenerator (property*)>
<!ATTLIST javaModelGenerator
  targetPackage CDATA #REQUIRED
  targetProject CDATA #REQUIRED>

<!ELEMENT javaTypeResolver (property*)>
<!ATTLIST javaTypeResolver
  type CDATA #IMPLIED>

<!ELEMENT sqlMapGenerator (property*)>
<!ATTLIST sqlMapGenerator
  targetPackage CDATA #REQUIRED
  targetProject CDATA #REQUIRED>

<!ELEMENT javaClientGenerator (property*)>
<!ATTLIST javaClientGenerator
  type CDATA #REQUIRED
  targetPackage CDATA #REQUIRED
  targetProject CDATA #REQUIRED
  implementationPackage CDATA #IMPLIED>

<!ELEMENT table (property*, generatedKey?, domainObjectRenamingRule?, columnRenamingRule?, (columnOverride | ignoreColumn | ignoreColumnsByRegex)*) >
<!ATTLIST table
  catalog CDATA #IMPLIED
  schema CDATA #IMPLIED
  tableName CDATA #REQUIRED
  alias CDATA #IMPLIED
  domainObjectName CDATA #IMPLIED
  mapperName CDATA #IMPLIED
  sqlProviderName CDATA #IMPLIED
  enableInsert CDATA #IMPLIED
  enableSelectByPrimaryKey CDATA #IMPLIED
  enableSelectByExample CDATA #IMPLIED
  enableUpdateByPrimaryKey CDATA #IMPLIED
  enableDeleteByPrimaryKey CDATA #IMPLIED
  enableDeleteByExample CDATA #IMPLIED
  enableCountByExample CDATA #IMPLIED
  enableUpdateByExample CDATA #IMPLIED
  selectByPrimaryKeyQueryId CDATA #IMPLIED
  selectByExampleQueryId CDATA #IMPLIED
  modelType CDATA #IMPLIED
  escapeWildcards CDATA #IMPLIED
  delimitIdentifiers CDATA #IMPLIED
  delimitAllColumns CDATA #IMPLIED>

<!ELEMENT columnOverride (property*)>
<!ATTLIST columnOverride
  column CDATA #REQUIRED
  property CDATA #IMPLIED
  javaType CDATA #IMPLIED
  jdbcType CDATA #IMPLIED
  typeHandler CDATA #IMPLIED
  isGeneratedAlways CDATA #IMPLIED
  delimitedColumnName CDATA #IMPLIED>

<!ELEMENT ignoreColumn EMPTY>
<!ATTLIST ignoreColumn
  column CDATA #REQUIRED
  delimitedColumnName CDATA #IMPLIED>

<!ELEMENT ignoreColumnsByRegex (except*)>
<!ATTLIST ignoreColumnsByRegex
  pattern CDATA #REQUIRED>

<!ELEMENT except EMPTY>
<!ATTLIST except
  column CDATA #REQUIRED
  delimitedColumnName CDATA #IMPLIED>

<!ELEMENT generatedKey EMPTY>
<!ATTLIST generatedKey
  column CDATA #REQUIRED
  sqlStatement CDATA #REQUIRED
  identity CDATA #IMPLIED
  type CDATA #IMPLIED>

<!ELEMENT domainObjectRenamingRule EMPTY>
<!ATTLIST domainObjectRenamingRule
  searchString CDATA #REQUIRED
  replaceString CDATA #IMPLIED>

<!ELEMENT columnRenamingRule EMPTY>
<!ATTLIST columnRenamingRule
  searchString CDATA #REQUIRED
  replaceString CDATA #IMPLIED>

<!ELEMENT commentGenerator (property*)>
<!ATTLIST commentGenerator
  type CDATA #IMPLIED>
  