<?xml version="1.0" encoding="UTF-8"?>
<!DOCTYPE generatorConfiguration SYSTEM "./src/main/resources/mybatis/mybatis-generator-config_1_0.dtd">
<!-- 配置生成器 -->
<generatorConfiguration>
    <!--执行generator插件生成文件的命令： call mvn mybatis-generator:generate -e -->
    <!-- 引入配置文件 -->
    <properties resource="application.properties"/>
    <!--classPathEntry:数据库的JDBC驱动,换成你自己的驱动位置 可选 -->
<!--    <classPathEntry location="C:\Users\19122\.m2\repository\mysql\mysql-connector-java\8.0.11\mysql-connector-java-8.0.11.jar" />-->

    <!-- 一个数据库一个context -->
    <!--defaultModelType="flat" 大数据字段，不分表 -->
    <context id="MysqlTables" targetRuntime="MyBatis3Simple" defaultModelType="flat">
        <!-- 自动识别数据库关键字，默认false，如果设置为true，根据SqlReservedWords中定义的关键字列表；
        一般保留默认值，遇到数据库关键字（Java关键字），使用columnOverride覆盖 -->
        <property name="autoDelimitKeywords" value="true" />
        <!-- 生成的Java文件的编码 -->
        <property name="javaFileEncoding" value="utf-8" />
        <!-- beginningDelimiter和endingDelimiter：指明数据库的用于标记数据库对象名的符''，比如ORACLE就是双引''，MYSQL默认是`反引''； -->
        <property name="beginningDelimiter" value="`" />
        <property name="endingDelimiter" value="`" />

        <!-- 格式化java代码 -->
        <property name="javaFormatter" value="org.mybatis.generator.api.dom.DefaultJavaFormatter"/>
        <!-- 格式化XML代码 -->
        <property name="xmlFormatter" value="org.mybatis.generator.api.dom.DefaultXmlFormatter"/>
        <plugin type="org.mybatis.generator.plugins.SerializablePlugin" />
        <plugin type="org.mybatis.generator.plugins.ToStringPlugin" />

        <!-- 注释 -->
        <commentGenerator >
            <property name="suppressAllComments" value="false"/><!-- 是否取消注释 -->
            <property name="suppressDate" value="true" /> <!-- 是否生成注释代时间戳-->
        </commentGenerator>
        <!-- jdbc连接 -->
        <jdbcConnection driverClass="${spring.datasource.driver-class-name}" connectionURL="${spring.datasource.url}"
                        userId="${spring.datasource.username}" password="${spring.datasource.password}" />
        <!-- 类型转换 -->
        <javaTypeResolver>
            <!-- 是否使用bigDecimal， false可自动转化以下类型（Long, Integer, Short, etc.） -->
            <property name="forceBigDecimals" value="false"/>
        </javaTypeResolver>


        <!-- 生成controller类地址 -->
        <javaControllerGenerator targetPackage="${spring.mybatis.controller}" targetProject="${spring.mybatis.project}" >
        </javaControllerGenerator>

        <!-- 生成service类地址 -->
        <javaServiceGenerator targetPackage="${spring.mybatis.service}" targetProject="${spring.mybatis.project}" >
        </javaServiceGenerator>

        <!-- 生成实体类地址 -->
        <javaModelGenerator targetPackage="${spring.mybatis.entity}" targetProject="${spring.mybatis.project}" >
            <property name="enableSubPackages" value="false"/>
            <property name="trimStrings" value="true"/>
        </javaModelGenerator>
        <!-- 生成mapxml文件 -->
        <sqlMapGenerator targetPackage="mappers" targetProject="${spring.mybatis.resources}" >
            <property name="enableSubPackages" value="false" />
        </sqlMapGenerator>
        <!-- 生成mapxml对应client，也就是接口dao -->
        <javaClientGenerator targetPackage="${spring.mybatis.dao}" targetProject="${spring.mybatis.project}" type="XMLMAPPER" >
            <property name="enableSubPackages" value="false" />
        </javaClientGenerator>
        <!-- table可以有多个,每个数据库中的表都可以写一个table，tableName表示要匹配的数据库表,也可以在tableName属性中通过使用%通配符来匹配所有数据库表,只有匹配的表才会自动生成文件 -->
        <table tableName="dept_inf"   domainObjectName="Dept" mapperName="DeptDao"
               enableCountByExample="false"
               enableUpdateByExample="false"
               enableDeleteByExample="false"
               enableSelectByExample="false"
               selectByExampleQueryId="false">
            <property name="useActualColumnNames" value="false" />
            <!-- 数据库表主键 -->
            <generatedKey column="id" sqlStatement="Mysql" identity="true" />
        </table>
    </context>
</generatorConfiguration>
